{
  "app_commit": "3a3f11207ac42ed66c4a072e81ba0594be0ecf20",
  "policy_digest": "sha256:b7ccc1ff9fdadb66399f48b26617a53572dd793ac7c57af55d72929561965b38",
  "policy_version": "2026-08.1",
  "schema": "outpocket.tool_export/1",
  "states": [
    {
      "accounting": {
        "description_bytes": 600,
        "estimated_tokens": 205,
        "schema_bytes": 182,
        "tool_count": 2,
        "total_bytes": 819
      },
      "label": "Nobody is signed in",
      "preconditions": {
        "open_report": "none",
        "role": "none",
        "verdict": "n_a"
      },
      "state_id": "S0-anon",
      "surface_digest": "sha256:f06bcc69e91399f550951ed1e7627b4999ba946884ec79503fc33aa8b2254d53",
      "tools": [
        {
          "annotations": {
            "readOnlyHint": true
          },
          "description": "Read whether an employee is signed in to Countinghouse, Meridian Fabrication's expense desk. Sign-in is the employee's own act, done in the page via company SSO — agents never see or present credentials. Returns the current sign-in state and what this page is for.",
          "inputSchema": {
            "properties": {},
            "type": "object"
          },
          "name": "get_signin_status"
        },
        {
          "annotations": {
            "readOnlyHint": true
          },
          "description": "Explain why a named tool is not on this page's tool surface right now, and what would bring it back. Returns the same violation envelope the expense rules use: a code, a severity, the field at issue, a one-sentence fix, and candidate tools taken from the surface as it currently stands. Tools that are present are reported as present.",
          "inputSchema": {
            "properties": {
              "name": {
                "description": "The tool to explain, for example submit_expense_report.",
                "type": "string"
              }
            },
            "required": [
              "name"
            ],
            "type": "object"
          },
          "name": "explain_missing_tool"
        }
      ]
    },
    {
      "accounting": {
        "description_bytes": 1385,
        "estimated_tokens": 531,
        "schema_bytes": 623,
        "tool_count": 6,
        "total_bytes": 2123
      },
      "label": "Employee signed in, no report open",
      "preconditions": {
        "open_report": "none",
        "role": "employee",
        "verdict": "n_a"
      },
      "state_id": "S1-emp-home",
      "surface_digest": "sha256:dddbdfd1bc404351540552bb5d16f91a701b2fbe8fba7d7872984e7fd2deea96",
      "tools": [
        {
          "annotations": {
            "readOnlyHint": true
          },
          "description": "Read the signed-in person's expense scope: name, role, cost center, chargeable projects with active flags, approver, and reimbursement currency. Everything an expense report can charge against comes from this session's scope, not from anything the agent supplies.",
          "inputSchema": {
            "properties": {},
            "type": "object"
          },
          "name": "get_session_scope"
        },
        {
          "annotations": {
            "readOnlyHint": true
          },
          "description": "Read the company expense policy as compact JSON: per-category caps, receipt and itemization thresholds, non-reimbursable items, accepted currencies with conversion rates, filing window, and the policy version. This is the same document the page enforces on every write — no policy needs to live in a prompt.",
          "inputSchema": {
            "properties": {},
            "type": "object"
          },
          "name": "get_expense_policy"
        },
        {
          "annotations": {
            "readOnlyHint": true
          },
          "description": "List this session's expense reports with id, title, project, status (draft or submitted), line count and USD total.",
          "inputSchema": {
            "properties": {},
            "type": "object"
          },
          "name": "list_expense_reports"
        },
        {
          "description": "Create a new draft expense report and open it in the page. Needs a short title and a project code from the employee's own scope (see get_session_scope); charges to closed or out-of-scope projects are refused by the server.",
          "inputSchema": {
            "properties": {
              "project": {
                "description": "Project code from the employee's scope, e.g. FALCON",
                "type": "string"
              },
              "title": {
                "description": "Short human-readable title, e.g. 'Boston client workshop'",
                "type": "string"
              }
            },
            "required": [
              "title",
              "project"
            ],
            "type": "object"
          },
          "name": "create_expense_report"
        },
        {
          "description": "Open an expense report in the page so the employee and the agent are looking at the same thing. Takes the report id from list_expense_reports.",
          "inputSchema": {
            "properties": {
              "report_id": {
                "description": "e.g. RP-1018",
                "type": "string"
              }
            },
            "required": [
              "report_id"
            ],
            "type": "object"
          },
          "name": "open_expense_report"
        },
        {
          "annotations": {
            "readOnlyHint": true
          },
          "description": "Explain why a named tool is not on this page's tool surface right now, and what would bring it back. Returns the same violation envelope the expense rules use: a code, a severity, the field at issue, a one-sentence fix, and candidate tools taken from the surface as it currently stands. Tools that are present are reported as present.",
          "inputSchema": {
            "properties": {
              "name": {
                "description": "The tool to explain, for example submit_expense_report.",
                "type": "string"
              }
            },
            "required": [
              "name"
            ],
            "type": "object"
          },
          "name": "explain_missing_tool"
        }
      ]
    },
    {
      "accounting": {
        "description_bytes": 3002,
        "estimated_tokens": 1603,
        "schema_bytes": 3157,
        "tool_count": 14,
        "total_bytes": 6412
      },
      "label": "Employee with a clean draft open; the report can be submitted",
      "preconditions": {
        "open_report": "draft",
        "role": "employee",
        "verdict": "clean"
      },
      "state_id": "S2-emp-draft-clean",
      "surface_digest": "sha256:e251898e471645517d481d803bbb3e39f02aad8bdf72228e5e9a916276cf10f4",
      "tools": [
        {
          "annotations": {
            "readOnlyHint": true
          },
          "description": "Read the signed-in person's expense scope: name, role, cost center, chargeable projects with active flags, approver, and reimbursement currency. Everything an expense report can charge against comes from this session's scope, not from anything the agent supplies.",
          "inputSchema": {
            "properties": {},
            "type": "object"
          },
          "name": "get_session_scope"
        },
        {
          "annotations": {
            "readOnlyHint": true
          },
          "description": "Read the company expense policy as compact JSON: per-category caps, receipt and itemization thresholds, non-reimbursable items, accepted currencies with conversion rates, filing window, and the policy version. This is the same document the page enforces on every write — no policy needs to live in a prompt.",
          "inputSchema": {
            "properties": {},
            "type": "object"
          },
          "name": "get_expense_policy"
        },
        {
          "annotations": {
            "readOnlyHint": true
          },
          "description": "List this session's expense reports with id, title, project, status (draft or submitted), line count and USD total.",
          "inputSchema": {
            "properties": {},
            "type": "object"
          },
          "name": "list_expense_reports"
        },
        {
          "description": "Create a new draft expense report and open it in the page. Needs a short title and a project code from the employee's own scope (see get_session_scope); charges to closed or out-of-scope projects are refused by the server.",
          "inputSchema": {
            "properties": {
              "project": {
                "description": "Project code from the employee's scope, e.g. FALCON",
                "type": "string"
              },
              "title": {
                "description": "Short human-readable title, e.g. 'Boston client workshop'",
                "type": "string"
              }
            },
            "required": [
              "title",
              "project"
            ],
            "type": "object"
          },
          "name": "create_expense_report"
        },
        {
          "description": "Open an expense report in the page so the employee and the agent are looking at the same thing. Takes the report id from list_expense_reports.",
          "inputSchema": {
            "properties": {
              "report_id": {
                "description": "e.g. RP-1018",
                "type": "string"
              }
            },
            "required": [
              "report_id"
            ],
            "type": "object"
          },
          "name": "open_expense_report"
        },
        {
          "annotations": {
            "readOnlyHint": true
          },